[
  {
    "strategy_id": "STR-DRN-001",
    "canonical_name": "DRAIN_DESILTING_AND_CLEARANCE",
    "display_name": "Drain Desilting and Obstruction Clearance",
    "short_description": "Desilting and clearing obstructions from major storm drains to restore flow capacity.",
    "domain_id": "DOM-DRN",
    "measure_type": "STRUCTURAL",
    "primary_hazard_id": "HAZ-FLD",
    "sector_ids": ["URBAN", "PUBLIC_INFRASTRUCTURE"],
    "planning_horizon": "SHORT_TERM",
    "evidence_status": "VERIFIED",
    "evidence_strength": "STRONG",
    "uncertainty_level": "LOW",
    "status": "ACTIVE",
    "aliases": ["drain desilting", "drain cleaning", "storm drain clearance"]
  },
  {
    "strategy_id": "STR-DRN-002",
    "canonical_name": "STORMWATER_NETWORK_EXPANSION",
    "display_name": "Stormwater Network Capacity Expansion",
    "short_description": "Expanding underground stormwater drainage conduits and increasing retention capacity.",
    "domain_id": "DOM-DRN",
    "measure_type": "INFRASTRUCTURE",
    "primary_hazard_id": "HAZ-FLD",
    "sector_ids": ["URBAN", "PUBLIC_INFRASTRUCTURE"],
    "planning_horizon": "MEDIUM_TERM",
    "evidence_status": "VERIFIED",
    "evidence_strength": "STRONG",
    "uncertainty_level": "LOW",
    "status": "ACTIVE",
    "aliases": ["stormwater network expansion", "drain capacity upgrade"]
  },
  {
    "strategy_id": "STR-WTR-001",
    "canonical_name": "ROOFTOP_RAINWATER_HARVESTING",
    "display_name": "Rooftop Rainwater Harvesting System",
    "short_description": "Installation of rooftop collection, filtration, and recharge structures for water storage and aquifer replenishment.",
    "domain_id": "DOM-WTR",
    "measure_type": "WATER_MANAGEMENT",
    "primary_hazard_id": "HAZ-DRG",
    "sector_ids": ["WATER", "HOUSING", "URBAN"],
    "planning_horizon": "SHORT_TERM",
    "evidence_status": "VERIFIED",
    "evidence_strength": "VERY_STRONG",
    "uncertainty_level": "LOW",
    "status": "ACTIVE",
    "aliases": ["rooftop rainwater harvesting", "rainwater harvesting", "roof water collection"]
  },
  {
    "strategy_id": "STR-WTR-002",
    "canonical_name": "TANK_AND_LAKE_RESTORATION",
    "display_name": "Traditional Tank and Lake Rehabilitation",
    "short_description": "Desilting, bund strengthening, and inlet/outlet channel restoration for ancient irrigation tanks and urban lakes.",
    "domain_id": "DOM-WTR",
    "measure_type": "WATER_MANAGEMENT",
    "primary_hazard_id": "HAZ-DRG",
    "sector_ids": ["WATER", "AGRICULTURE", "ENVIRONMENT"],
    "planning_horizon": "MEDIUM_TERM",
    "evidence_status": "VERIFIED",
    "evidence_strength": "VERY_STRONG",
    "uncertainty_level": "LOW",
    "status": "ACTIVE",
    "aliases": ["tank restoration", "lake desilting", "erie restoration"]
  },
  {
    "strategy_id": "STR-URB-001",
    "canonical_name": "FLOODPLAIN_ZONING_AND_SETBACKS",
    "display_name": "Floodplain Zoning & Setback Regulation",
    "short_description": "Enforcing development prohibitions along river corridors and designated floodplains.",
    "domain_id": "DOM-URB",
    "measure_type": "PLANNING",
    "primary_hazard_id": "HAZ-FLD",
    "sector_ids": ["LAND_USE", "URBAN"],
    "planning_horizon": "LONG_TERM",
    "evidence_status": "VERIFIED",
    "evidence_strength": "STRONG",
    "uncertainty_level": "MEDIUM",
    "status": "ACTIVE",
    "aliases": ["floodplain zoning", "development setbacks", "river corridor protection"]
  },
  {
    "strategy_id": "STR-NBS-001",
    "canonical_name": "URBAN_WETLAND_RESTORATION",
    "display_name": "Urban Wetland & Marsh Protection",
    "short_description": "Restoring natural hydrologic functions of urban wetlands to absorb peak flood discharges and enhance biodiversity.",
    "domain_id": "DOM-NBS",
    "measure_type": "NATURE_BASED",
    "primary_hazard_id": "HAZ-FLD",
    "sector_ids": ["ECOSYSTEMS", "WATER", "URBAN"],
    "planning_horizon": "MEDIUM_TERM",
    "evidence_status": "VERIFIED",
    "evidence_strength": "STRONG",
    "uncertainty_level": "LOW",
    "status": "ACTIVE",
    "aliases": ["wetland restoration", "marshland protection", "natural sponge restoration"]
  },
  {
    "strategy_id": "STR-NBS-002",
    "canonical_name": "RAIN_GARDENS_AND_BIOSWALES",
    "display_name": "Rain Gardens and Bioswales",
    "short_description": "Vegetated channels and bioretention areas to slow runoff velocity and filter urban stormwater.",
    "domain_id": "DOM-NBS",
    "measure_type": "NATURE_BASED",
    "primary_hazard_id": "HAZ-FLD",
    "sector_ids": ["URBAN", "ECOSYSTEMS"],
    "planning_horizon": "SHORT_TERM",
    "evidence_status": "VERIFIED",
    "evidence_strength": "MODERATE",
    "uncertainty_level": "MEDIUM",
    "status": "ACTIVE",
    "aliases": ["bioswales", "rain gardens", "bioretention cells"]
  },
  {
    "strategy_id": "STR-BLD-001",
    "canonical_name": "COOL_ROOF_RETROFIT",
    "display_name": "Cool Roof Reflective Surface Coating",
    "short_description": "Application of high-albedo coatings and cool reflective tiles on building roofs to lower indoor thermal absorption.",
    "domain_id": "DOM-BLD",
    "measure_type": "BUILDING_RETROFIT",
    "primary_hazard_id": "HAZ-HTW",
    "sector_ids": ["HOUSING", "HEALTH", "URBAN"],
    "planning_horizon": "SHORT_TERM",
    "evidence_status": "PARTIALLY_VERIFIED",
    "evidence_strength": "MODERATE",
    "uncertainty_level": "MEDIUM",
    "status": "REQUIRES_REVIEW",
    "aliases": ["cool roofs", "reflective roofs", "white roof coating"]
  },
  {
    "strategy_id": "STR-BLD-002",
    "canonical_name": "CRITICAL_FACILITY_FLOOD_PROOFING",
    "display_name": "Critical Facility Flood Protection & Elevation",
    "short_description": "Retrofitting electrical equipment, substations, and ground-floor utilities above maximum flood elevation.",
    "domain_id": "DOM-BLD",
    "measure_type": "STRUCTURAL",
    "primary_hazard_id": "HAZ-FLD",
    "sector_ids": ["CRITICAL_INFRASTRUCTURE", "HEALTH", "ENERGY"],
    "planning_horizon": "SHORT_TERM",
    "evidence_status": "VERIFIED",
    "evidence_strength": "STRONG",
    "uncertainty_level": "LOW",
    "status": "ACTIVE",
    "aliases": ["substation elevation", "hospital flood proofing", "utility raising"]
  },
  {
    "strategy_id": "STR-GIS-001",
    "canonical_name": "TERRAIN_DEPRESSION_FLOOD_BUFFERING",
    "display_name": "Terrain-Sensitive Flood Storage Preservation",
    "short_description": "GIS-based elevation mapping to safeguard natural topographical depressions and flow paths from urban encroachment.",
    "domain_id": "DOM-GIS",
    "measure_type": "PLANNING",
    "primary_hazard_id": "HAZ-FLD",
    "sector_ids": ["LAND_USE", "DISASTER_MANAGEMENT"],
    "planning_horizon": "LONG_TERM",
    "evidence_status": "VERIFIED",
    "evidence_strength": "STRONG",
    "uncertainty_level": "LOW",
    "status": "ACTIVE",
    "aliases": ["terrain storage preservation", "depression zoning", "flow path protection"]
  },
  {
    "strategy_id": "STR-CIN-001",
    "canonical_name": "HOSPITAL_BACKUP_POWER_AND_WATER",
    "display_name": "Hospital Emergency Power & Auxiliary Water Resilience",
    "short_description": "Redundant solar/generator power backup and high-capacity water storage for healthcare facilities during disasters.",
    "domain_id": "DOM-CIN",
    "measure_type": "INFRASTRUCTURE",
    "primary_hazard_id": "HAZ-FLD",
    "sector_ids": ["HEALTH", "CRITICAL_INFRASTRUCTURE"],
    "planning_horizon": "IMMEDIATE",
    "evidence_status": "VERIFIED",
    "evidence_strength": "VERY_STRONG",
    "uncertainty_level": "LOW",
    "status": "ACTIVE",
    "aliases": ["hospital generator backup", "health infrastructure resilience"]
  },
  {
    "strategy_id": "STR-EWS-001",
    "canonical_name": "IOT_WATER_LEVEL_AND_FLOOD_MONITORING",
    "display_name": "IoT Water Level Sensor Network & Alert System",
    "short_description": "Real-time ultrasonic water level sensors deployed at critical urban drains and river bridges for early flood warnings.",
    "domain_id": "DOM-EWS",
    "measure_type": "EARLY_WARNING",
    "primary_hazard_id": "HAZ-FLD",
    "sector_ids": ["DISASTER_MANAGEMENT", "URBAN"],
    "planning_horizon": "IMMEDIATE",
    "evidence_status": "VERIFIED",
    "evidence_strength": "VERY_STRONG",
    "uncertainty_level": "LOW",
    "status": "ACTIVE",
    "aliases": ["flood early warning", "IoT water level sensor", "river level alert"]
  },
  {
    "strategy_id": "STR-HTR-001",
    "canonical_name": "URBAN_SHADE_AND_COOLING_SHELTERS",
    "display_name": "Urban Cooling Centers and Shade Canopy Deployment",
    "short_description": "Public air-conditioned cooling centers and solar shade structures in outdoor bus terminals and high-density zones.",
    "domain_id": "DOM-HTR",
    "measure_type": "PREPAREDNESS",
    "primary_hazard_id": "HAZ-HTW",
    "sector_ids": ["HEALTH", "URBAN", "DISASTER_MANAGEMENT"],
    "planning_horizon": "SHORT_TERM",
    "evidence_status": "VERIFIED",
    "evidence_strength": "STRONG",
    "uncertainty_level": "LOW",
    "status": "ACTIVE",
    "aliases": ["cooling centers", "heat shelters", "urban shade canopy"]
  },
  {
    "strategy_id": "STR-CST-001",
    "canonical_name": "MANGROVE_ECOSYSTEM_RESTORATION",
    "display_name": "Coastal Mangrove Buffer Belt Restoration",
    "short_description": "Restoration of coastal mangrove bio-shields along estuaries and tidal creeks to dissipate storm surge energy and prevent coastal erosion.",
    "domain_id": "DOM-CST",
    "measure_type": "ECOSYSTEM_BASED",
    "primary_hazard_id": "HAZ-FLD",
    "sector_ids": ["COASTAL", "ECOSYSTEMS", "ENVIRONMENT"],
    "planning_horizon": "MEDIUM_TERM",
    "evidence_status": "VERIFIED",
    "evidence_strength": "VERY_STRONG",
    "uncertainty_level": "LOW",
    "status": "ACTIVE",
    "aliases": ["mangrove restoration", "coastal bio-shield", "mangrove buffer"]
  }
]
